<?xml version="1.0" encoding="UTF-8"?>

<medicines xmlns="http://training.by/medicine"
           xmlns:xsi="http://www.w3.org/2001/XMLSchema-instance"
           xsi:schemaLocation="http://training.by/medicine medicines.xsd">
    <medicine>
        <name>Парацетамол</name>
        <pharm>Ирбитский химфармзавод ОАО</pharm>
        <group>antibiotics</group>
        <analog>Тайленол</analog>
        <analog>Апап</analog>
        <versions>
            <version type="tablets">
                <producer>
                    <limited_certificate number="ЛСР-009047/08">
                        <issue_date>2019-03-22</issue_date>
                        <organization>BelMedicines</organization>
                        <expiration_date>2020-09-22</expiration_date>
                    </limited_certificate>
                    <package type="blister_packaging">
                        <quantity>10</quantity>
                        <price>100</price>
                    </package>
                    <dosage>
                        <count>3</count>
                        <period>day</period>
                    </dosage>
                </producer>
            </version>
            <version type="capsules">
                <producer>
                    <certificate number="ЛСР">
                        <issue_date>2020-03-22</issue_date>
                        <organization>BelMed</organization>
                    </certificate>
                    <package type="vial">
                        <quantity>50</quantity>
                        <price>500</price>
                    </package>
                    <dosage>
                        <count>6</count>
                        <period>week</period>
                    </dosage>
                </producer>
            </version>
        </versions>
    </medicine>

</medicines>